{
  "cases": [
    {
      "case_id": "set-status-transitions-restore-clears-rsvps",
      "expected": {
        "final_state": {
          "fixed_runs": [
            {
              "bosses": [
                "HMaleficStar",
                "HFA"
              ],
              "channel_id": "222",
              "id": "00000000-0000-4000-8002-000000000001",
              "note": null,
              "owner_id": "1001",
              "participants": [
                "1001",
                "1002"
              ],
              "time": "21:30",
              "weekday": 0
            }
          ],
          "reminders": [
            {
              "fire_at": "2026-08-31T01:00:00+00:00",
              "id": "00000000-0000-4000-8002-000000000030",
              "kind": "day_of",
              "message_id": null,
              "run_id": "00000000-0000-4000-8002-000000000002",
              "sent_at": null
            },
            {
              "fire_at": "2026-08-31T12:30:00+00:00",
              "id": "00000000-0000-4000-8002-000000000031",
              "kind": "countdown_60",
              "message_id": null,
              "run_id": "00000000-0000-4000-8002-000000000002",
              "sent_at": null
            },
            {
              "fire_at": "2026-08-31T13:15:00+00:00",
              "id": "00000000-0000-4000-8002-000000000032",
              "kind": "countdown_15",
              "message_id": null,
              "run_id": "00000000-0000-4000-8002-000000000002",
              "sent_at": null
            },
            {
              "fire_at": "2026-09-07T01:00:00+00:00",
              "id": "00000000-0000-4000-8002-000000000007",
              "kind": "day_of",
              "message_id": null,
              "run_id": "00000000-0000-4000-8002-000000000006",
              "sent_at": null
            },
            {
              "fire_at": "2026-09-07T12:30:00+00:00",
              "id": "00000000-0000-4000-8002-000000000008",
              "kind": "countdown_60",
              "message_id": null,
              "run_id": "00000000-0000-4000-8002-000000000006",
              "sent_at": null
            },
            {
              "fire_at": "2026-09-07T13:15:00+00:00",
              "id": "00000000-0000-4000-8002-000000000009",
              "kind": "countdown_15",
              "message_id": null,
              "run_id": "00000000-0000-4000-8002-000000000006",
              "sent_at": null
            },
            {
              "fire_at": "2026-09-14T01:00:00+00:00",
              "id": "00000000-0000-4000-8002-000000000011",
              "kind": "day_of",
              "message_id": null,
              "run_id": "00000000-0000-4000-8002-000000000010",
              "sent_at": null
            },
            {
              "fire_at": "2026-09-14T12:30:00+00:00",
              "id": "00000000-0000-4000-8002-000000000012",
              "kind": "countdown_60",
              "message_id": null,
              "run_id": "00000000-0000-4000-8002-000000000010",
              "sent_at": null
            },
            {
              "fire_at": "2026-09-14T13:15:00+00:00",
              "id": "00000000-0000-4000-8002-000000000013",
              "kind": "countdown_15",
              "message_id": null,
              "run_id": "00000000-0000-4000-8002-000000000010",
              "sent_at": null
            }
          ],
          "rsvps": [
            {
              "at": "2026-08-26T17:00:00+00:00",
              "run_id": "00000000-0000-4000-8002-000000000002",
              "source": "chat",
              "state": "no",
              "user_id": "1003"
            }
          ],
          "runs": [
            {
              "bosses": [
                "HMaleficStar",
                "HFA"
              ],
              "channel_id": "222",
              "datetime": "2026-08-31T13:30:00+00:00",
              "fixed_run_id": "00000000-0000-4000-8002-000000000001",
              "id": "00000000-0000-4000-8002-000000000002",
              "participants": [
                "1001",
                "1002"
              ],
              "source": "fixed",
              "status": "planned",
              "week_start": "2026-08-26T16:00:00+00:00"
            },
            {
              "bosses": [
                "HMaleficStar",
                "HFA"
              ],
              "channel_id": "222",
              "datetime": "2026-09-07T13:30:00+00:00",
              "fixed_run_id": "00000000-0000-4000-8002-000000000001",
              "id": "00000000-0000-4000-8002-000000000006",
              "participants": [
                "1001",
                "1002"
              ],
              "source": "fixed",
              "status": "planned",
              "week_start": "2026-09-02T16:00:00+00:00"
            },
            {
              "bosses": [
                "HMaleficStar",
                "HFA"
              ],
              "channel_id": "222",
              "datetime": "2026-09-14T13:30:00+00:00",
              "fixed_run_id": "00000000-0000-4000-8002-000000000001",
              "id": "00000000-0000-4000-8002-000000000010",
              "participants": [
                "1001",
                "1002"
              ],
              "source": "fixed",
              "status": "planned",
              "week_start": "2026-09-09T16:00:00+00:00"
            }
          ],
          "side_effects": [
            {
              "channel_id": "222",
              "effect_context": [
                "00000000-0000-4000-8002-000000000002",
                "planned",
                "confirmed",
                "portal"
              ],
              "effect_kind": "notice.run.status.confirmed",
              "mentions": [
                "1001"
              ]
            },
            {
              "channel_id": "222",
              "effect_context": [
                "00000000-0000-4000-8002-000000000002",
                "confirmed",
                "otot",
                "command"
              ],
              "effect_kind": "notice.run.status.otot",
              "mentions": [
                "1001"
              ]
            },
            {
              "channel_id": "222",
              "effect_context": [
                "00000000-0000-4000-8002-000000000002",
                "otot",
                "planned",
                "portal"
              ],
              "effect_kind": "notice.run.status.planned",
              "mentions": [
                "1001"
              ]
            },
            {
              "channel_id": "222",
              "effect_context": [
                "00000000-0000-4000-8002-000000000002",
                "cancelled",
                "planned",
                "portal"
              ],
              "effect_kind": "notice.run.status.planned",
              "mentions": [
                "1001"
              ]
            },
            {
              "channel_id": "222",
              "effect_context": [
                "00000000-0000-4000-8002-000000000002",
                "planned",
                "done",
                "portal"
              ],
              "effect_kind": "notice.run.status.done",
              "mentions": [
                "1001"
              ]
            },
            {
              "channel_id": "222",
              "effect_context": [
                "00000000-0000-4000-8002-000000000002",
                "done",
                "planned",
                "portal"
              ],
              "effect_kind": "notice.run.status.planned",
              "mentions": [
                "1001"
              ]
            }
          ]
        },
        "steps": [
          {
            "value": "00000000-0000-4000-8002-000000000001"
          },
          {
            "value": null
          },
          {
            "value": "yes"
          },
          {
            "value": "maybe"
          },
          {
            "value": "no"
          },
          {
            "value": {
              "bosses": [
                "HMaleficStar",
                "HFA"
              ],
              "channel_id": "222",
              "datetime": "2026-08-31T13:30:00+00:00",
              "id": "00000000-0000-4000-8002-000000000002",
              "participants": [
                {
                  "id": "1001",
                  "rsvp": "yes"
                },
                {
                  "id": "1002",
                  "rsvp": "maybe"
                }
              ],
              "roster_change": {
                "changed": false,
                "in": [],
                "out": []
              },
              "status": "confirmed",
              "week_start": "2026-08-26T16:00:00+00:00"
            }
          },
          {
            "value": {
              "bosses": [
                "HMaleficStar",
                "HFA"
              ],
              "channel_id": "222",
              "datetime": "2026-08-31T13:30:00+00:00",
              "id": "00000000-0000-4000-8002-000000000002",
              "participants": [
                {
                  "id": "1001",
                  "rsvp": "yes"
                },
                {
                  "id": "1002",
                  "rsvp": "maybe"
                }
              ],
              "roster_change": {
                "changed": false,
                "in": [],
                "out": []
              },
              "status": "confirmed",
              "week_start": "2026-08-26T16:00:00+00:00"
            }
          },
          {
            "value": {
              "bosses": [
                "HMaleficStar",
                "HFA"
              ],
              "channel_id": "222",
              "datetime": "2026-08-31T13:30:00+00:00",
              "id": "00000000-0000-4000-8002-000000000002",
              "participants": [
                {
                  "id": "1001",
                  "rsvp": "yes"